{
  "id": "550e8400-e29b-41d4-a716-446655440002",
  "timestamp": "2026-01-09T15:45:30Z",
  "source": {
    "language": "other",
    "name": "ci-deployer",
    "version": "1.5.2",
    "environment": "production",
    "hostname": "github-actions-runner-5",
    "tags": ["ci-cd", "deployment", "prod"]
  },
  "message": "Deployment timeout after 30 minutes: Waiting for app-api-v2.3.0 rollout to complete. 3 out of 8 replicas ready. Likely blocked by downstream service dependency.",
  "error_type": "RolloutTimeoutError",
  "severity": "critical",
  "stack_trace": "github.com/kubernetes/client-go/tools/watch.WaitForCondition() at watch.go:421\n  main.waitForDeploymentReady() at deploy.go:178",
  "metadata": {
    "component": "deployment",
    "cluster": "prod-us-east-1",
    "deployment_name": "app-api-v2.3.0",
    "namespace": "default",
    "replicas_total": 8,
    "replicas_ready": 3,
    "timeout_seconds": 1800,
    "workflow_id": "github-actions-run-12345",
    "git_commit": "a1b2c3d4e5f6"
  },
  "evidence": [
    {
      "type": "log_line",
      "data": {
        "timestamp": "2026-01-09T15:45:15Z",
        "source": "pod-app-api-deployment-pod-4",
        "level": "ERROR",
        "message": "Failed to initialize: cannot connect to database service 'postgres-svc.prod-infra:5432' - connection refused"
      }
    },
    {
      "type": "http_request",
      "data": {
        "method": "GET",
        "url": "http://postgres-svc.prod-infra:5432",
        "timeout_ms": 3000,
        "status": "connection_refused",
        "timestamp": "2026-01-09T15:45:10Z"
      }
    },
    {
      "type": "metric",
      "data": {
        "metric_name": "postgres_up",
        "value": 0,
        "timestamp": "2026-01-09T15:44:50Z",
        "labels": {
          "instance": "postgres-svc.prod-infra",
          "job": "prometheus"
        }
      }
    },
    {
      "type": "event",
      "data": {
        "type": "Service",
        "name": "postgres-svc",
        "namespace": "prod-infra",
        "action": "modified",
        "timestamp": "2026-01-09T15:30:00Z",
        "change_summary": "ServicePort 5432 temporarily removed during maintenance window (expected to be restored in 10 min)"
      }
    },
    {
      "type": "log_line",
      "data": {
        "timestamp": "2026-01-09T15:35:22Z",
        "source": "postgres-maintenance-pod",
        "level": "INFO",
        "message": "Database maintenance started. Estimated duration: 10 minutes. Maintenance ID: maint-2026-01-09-1"
      }
    }
  ]
}
